{
  "schemaVersion": 1,
  "generatedAt": "2028-03-20T09:00:00Z",
  "coId": "co_01jh0y4e1np5s9zb7t2x6v8a0d",
  "name": "Example Industries AG",
  "domains": ["example.com", "example.net"],
  "verification": "domain-verified",
  "entitlements": [
    {
      "entId": "ent_01jh0y4e1np5s9zb7t2x6v8a1d",
      "lane": "project",
      "scope": {
        "kind": "project",
        "repos": ["R_kgDOAbc123"]
      },
      "status": "active",
      "periodStart": "2027-03-20T00:00:00Z",
      "periodEnd": "2028-03-19T00:00:00Z",
      "graceEnd": "2028-04-18T00:00:00Z",
      "scheduleVersion": "v1",
      "vestedWindows": [{ "from": "2027-03-20", "to": "2028-03-19" }]
    },
    {
      "entId": "ent_01jf8w2c9km3q7xz5r0v4t6y9b",
      "lane": "project",
      "scope": {
        "kind": "project",
        "repos": ["R_kgDOAbc123"]
      },
      "status": "active",
      "periodStart": "2026-03-20T00:00:00Z",
      "periodEnd": "2027-03-19T00:00:00Z",
      "graceEnd": "2027-04-18T00:00:00Z",
      "scheduleVersion": "v1",
      "vestedWindows": [{ "from": "2026-03-20", "to": "2027-03-19" }]
    }
  ]
}
